[
  {
    "author_actor_id": "git/email/232372188cfb5a89",
    "author_email": "tom@posthog.com",
    "author_is_committer": false,
    "author_name": "Tom Owers",
    "authored_at": "2026-07-27T11:48:12Z",
    "cherry_pick_of_sha": null,
    "co_author_actor_ids": [],
    "co_author_count": 0,
    "co_authors": [],
    "commit_id": "github.com/PostHog/posthog#commit/00036d38ae536175d63455c0d0055affe43250cc",
    "commit_sha": "00036d38ae536175d63455c0d0055affe43250cc",
    "committed_at": "2026-07-27T11:48:12Z",
    "committer_actor_id": "git/email/3c205d8fc749f729",
    "committer_email": "noreply@github.com",
    "committer_name": "GitHub",
    "extractor_version": "1.0.0",
    "gpg_status": "N",
    "has_ai_co_author": false,
    "has_patch_text": false,
    "in_window": true,
    "is_cherry_pick": false,
    "is_merge_commit": false,
    "is_revert": false,
    "message": "fix(shopify): treat 401 from the Admin API as non-retryable (#73802)\n",
    "message_sha256": "ae7458b5db331196f98174924836723a75c983cb0a9bfc33583f9a19ef928aa4",
    "parent_count": 1,
    "parent_shas": [
      "666ed3c5938a092a777220dad3fbdddbb85f4601"
    ],
    "patch_unavailable_reason": null,
    "pr_mapping_source": "github_merge_commit",
    "pr_number": 73802,
    "pr_number_from_subject": 73802,
    "revert_of_sha": null,
    "revert_of_subject": null,
    "subject": "fix(shopify): treat 401 from the Admin API as non-retryable (#73802)",
    "trailers": {
      "co-authored-by": null,
      "signed-off-by": null
    },
    "tree_sha": "960fff81a3a5449ca4328b2ed39d1f25e2307414"
  },
  {
    "author_actor_id": "github/user/adamleithp",
    "author_email": "adamleithp@users.noreply.github.com",
    "author_is_committer": false,
    "author_name": "Adam Leith",
    "authored_at": "2026-04-21T13:02:26Z",
    "cherry_pick_of_sha": null,
    "co_author_actor_ids": [
      "git/email/cd29c5ac348a026a"
    ],
    "co_author_count": 1,
    "co_authors": [
      {
        "email": "noreply@anthropic.com",
        "name": "Claude Opus 4.6 (1M context)"
      }
    ],
    "commit_id": "github.com/PostHog/posthog#commit/0003aa972a2cfcd8e47c3bb6f47c04eb6209c2b8",
    "commit_sha": "0003aa972a2cfcd8e47c3bb6f47c04eb6209c2b8",
    "committed_at": "2026-04-21T13:02:26Z",
    "committer_actor_id": "git/email/3c205d8fc749f729",
    "committer_email": "noreply@github.com",
    "committer_name": "GitHub",
    "extractor_version": "1.0.0",
    "gpg_status": "N",
    "has_ai_co_author": true,
    "has_patch_text": false,
    "in_window": false,
    "is_cherry_pick": false,
    "is_merge_commit": false,
    "is_revert": false,
    "message": "feat(quill): add MenuEmpty component, focus ring polish, file renames (#55486)\n\nCo-authored-by: Claude Opus 4.6 (1M context) <noreply@anthropic.com>\n",
    "message_sha256": "dc03e25d91f1f206235fe2b2ddcd2aac77a02a3bced258e504806b9c60843ddb",
    "parent_count": 1,
    "parent_shas": [
      "e27e37071c0cc9e0aee6ba8dc809f6960963a157"
    ],
    "patch_unavailable_reason": null,
    "pr_mapping_source": null,
    "pr_number": null,
    "pr_number_from_subject": 55486,
    "revert_of_sha": null,
    "revert_of_subject": null,
    "subject": "feat(quill): add MenuEmpty component, focus ring polish, file renames (#55486)",
    "trailers": {
      "co-authored-by": [
        "Claude Opus 4.6 (1M context) <noreply@anthropic.com>"
      ],
      "signed-off-by": null
    },
    "tree_sha": "a627fa0652b8c08e59d873291e0a5cc490b524aa"
  },
  {
    "author_actor_id": "github/user/sampennington",
    "author_email": "56024559+sampennington@users.noreply.github.com",
    "author_is_committer": false,
    "author_name": "Sam Pennington",
    "authored_at": "2026-05-01T08:14:18Z",
    "cherry_pick_of_sha": null,
    "co_author_actor_ids": [
      "git/email/cd29c5ac348a026a"
    ],
    "co_author_count": 1,
    "co_authors": [
      {
        "email": "noreply@anthropic.com",
        "name": "Claude Opus 4.7 (1M context)"
      }
    ],
    "commit_id": "github.com/PostHog/posthog#commit/00040714f156b0a283ec79590e19e94ff9c6589b",
    "commit_sha": "00040714f156b0a283ec79590e19e94ff9c6589b",
    "committed_at": "2026-05-01T08:14:18Z",
    "committer_actor_id": "git/email/3c205d8fc749f729",
    "committer_email": "noreply@github.com",
    "committer_name": "GitHub",
    "extractor_version": "1.0.0",
    "gpg_status": "N",
    "has_ai_co_author": true,
    "has_patch_text": false,
    "in_window": false,
    "is_cherry_pick": false,
    "is_merge_commit": false,
    "is_revert": false,
    "message": "feat(hog-charts): add bar canvas primitives (#57210)\n\nCo-authored-by: Claude Opus 4.7 (1M context) <noreply@anthropic.com>\n",
    "message_sha256": "5c912d1cc3f2e1bc1a6ec1cf7b8acf6478bc184e00460a971980f65ed075e615",
    "parent_count": 1,
    "parent_shas": [
      "70d90907525e25d28f91ffd4f86824a168b0db9c"
    ],
    "patch_unavailable_reason": null,
    "pr_mapping_source": null,
    "pr_number": null,
    "pr_number_from_subject": 57210,
    "revert_of_sha": null,
    "revert_of_subject": null,
    "subject": "feat(hog-charts): add bar canvas primitives (#57210)",
    "trailers": {
      "co-authored-by": [
        "Claude Opus 4.7 (1M context) <noreply@anthropic.com>"
      ],
      "signed-off-by": null
    },
    "tree_sha": "8d64e9013ab8c51c6ddb66a48f6ee623d4bc1d3b"
  },
  {
    "author_actor_id": "git/email/e66b4abc9f8afe05",
    "author_email": "matt.p@posthog.com",
    "author_is_committer": false,
    "author_name": "Matt Pua",
    "authored_at": "2026-06-04T14:58:32Z",
    "cherry_pick_of_sha": null,
    "co_author_actor_ids": [],
    "co_author_count": 0,
    "co_authors": [],
    "commit_id": "github.com/PostHog/posthog#commit/00069ca66a70af631a6008c3eb7fa4eae1d5c87f",
    "commit_sha": "00069ca66a70af631a6008c3eb7fa4eae1d5c87f",
    "committed_at": "2026-06-04T14:58:32Z",
    "committer_actor_id": "git/email/3c205d8fc749f729",
    "committer_email": "noreply@github.com",
    "committer_name": "GitHub",
    "extractor_version": "1.0.0",
    "gpg_status": "N",
    "has_ai_co_author": false,
    "has_patch_text": false,
    "in_window": true,
    "is_cherry_pick": false,
    "is_merge_commit": false,
    "is_revert": false,
    "message": "feat(dashboards): show widget placeholders on shared dashboards (2/4) (#61416)\n\n## Problem\n\nShared dashboards previously hid widget tiles entirely or showed empty space. Viewers couldn't see that a dashboard includes error tracking or session replay widgets, and the frontend still attempted widget data fetches that shared pages cannot satisfy.\n\n## Changes\n\n- Show widget tiles on **Public** shared dashboards with a PostHoggy placeholder body and per-widget copy (error tracking vs session replay)\n- Serialize **metadata-only** widget payloads on shared dashboards (`id`, `widget_type`, `name`, `description`, `config`) \u2014 no user fields or query results\n- Skip `run_widgets` fetches on Public/Export placements; enable widget rendering on shared pages when tile metadata is present (shared pages don't receive team feature flags)\n- Hide widget tiles on Export placement (PNG/embed exports)\n\n## How did you test this code?\n\nAutomated tests (agent-authored; no manual browser verification in this session):\n\n- `dashboardLogic.test.ts` \u2014 public placement skips widget fetch; widgets enabled when tile metadata present\n- `DashboardWidgetItem.test.tsx` \u2014 shared placeholder renders per-widget copy\n- `test_dashboard_widgets.py::test_shared_dashboard_tile_serializer_omits_widget_payload`\n- `test_sharing.py::TestSharedCohortInlining::test_shared_dashboard_includes_widget_metadata_only`\n\n\ud83d\udc49 _Stay up-to-date with [PostHog coding conventions](https://posthog.com/docs/contribute/coding-conventions) for a smoother review._\n\n## Automatic notifications\n\n- [ ] Publish to changelog?\n- [ ] Alert Sales and Marketing teams?\n\n## Docs update\n\nNo docs changes in this PR \u2014 behavior is additive for shared dashboard rendering.\n\n## \ud83e\udd16 Agent context\n\nAgent-assisted PR (Cursor). Builds on the dashboard widget stack (error tracking + session replay widgets).\n\nKey decisions:\n- Shared widget data path lives in `SharingViewSet` with `is_shared=True`; removed dead share-token guards on `DashboardsViewSet` that could never fire\n- Public shared pages bypass the `dashboard-widgets` feature flag when exported tile metadata exists, since shared exports don't include team feature flags\n- Placeholder copy is catalog-driven so new widget types can define their own shared messaging\n\nKnown follow-up (not in this PR): widget/insight tiles with overlapping grid coordinates may render in a different visual order on shared dashboards vs the private editor.\n",
    "message_sha256": "16f9f608b3848f45a29bc7dddabcc596c6df7a1aa4c4b5696b7a1761c975be23",
    "parent_count": 1,
    "parent_shas": [
      "b18bec2c2eb678624e7c1f69837786afc31ddb07"
    ],
    "patch_unavailable_reason": null,
    "pr_mapping_source": "github_merge_commit",
    "pr_number": 61416,
    "pr_number_from_subject": 61416,
    "revert_of_sha": null,
    "revert_of_subject": null,
    "subject": "feat(dashboards): show widget placeholders on shared dashboards (2/4) (#61416)",
    "trailers": {
      "co-authored-by": null,
      "signed-off-by": null
    },
    "tree_sha": "376bdc9081454f62edbec7339005e4a42238ab2c"
  },
  {
    "author_actor_id": "git/email/e81bc245d9eb79ce",
    "author_email": "tue.haulund@gmail.com",
    "author_is_committer": false,
    "author_name": "Tue Haulund",
    "authored_at": "2026-06-17T19:55:16Z",
    "cherry_pick_of_sha": null,
    "co_author_actor_ids": [
      "git/email/8e3a7609315ec47d"
    ],
    "co_author_count": 1,
    "co_authors": [
      {
        "email": "250237707+tests-posthog[bot]@users.noreply.github.com",
        "name": "tests-posthog[bot]"
      }
    ],